0002:01:00.0 Ethernet controller: Cavium, Inc. THUNDERX Network Interface Controller (rev 08)
	Subsystem: Cavium, Inc. Device a11e
	Control: I/O- Mem+ BusMaster+ SpecCycle- MemWINV- VGASnoop- ParErr- Stepping- SERR- FastB2B- DisINTx-
	Status: Cap+ 66MHz- UDF- FastB2B- ParErr- DEVSEL=fast >TAbort- <TAbort- <MAbort- >SERR- <PERR- INTx-
	Latency: 0
	Region 0: [virtual] Memory at 843000000000 (32-bit, non-prefetchable) [size=1G]
	Region 4: [virtual] Memory at 843060000000 (32-bit, non-prefetchable) [size=1M]
	Capabilities: [40] Express (v2) Endpoint, MSI 00
		DevCap:	MaxPayload 128 bytes, PhantFunc 0, Latency L0s <64ns, L1 <1us
			ExtTag- AttnBtn- AttnInd- PwrInd- RBE- FLReset- SlotPowerLimit 0.000W
		DevCtl:	Report errors: Correctable- Non-Fatal- Fatal- Unsupported-
			RlxdOrd- ExtTag- PhantFunc- AuxPwr- NoSnoop-
			MaxPayload 128 bytes, MaxReadReq 128 bytes
		DevSta:	CorrErr- UncorrErr- FatalErr- UnsuppReq- AuxPwr- TransPend-
		LnkCap:	Port #0, Speed unknown, Width x0, ASPM not supported, Exit Latency L0s <64ns, L1 <1us
			ClockPM- Surprise- LLActRep- BwNot- ASPMOptComp-
		LnkCtl:	ASPM Disabled; RCB 64 bytes Disabled- CommClk-
			ExtSynch- ClockPM- AutWidDis- BWInt- AutBWInt-
		LnkSta:	Speed unknown, Width x0, TrErr- Train- SlotClk- DLActive- BWMgmt- ABWMgmt-
		DevCap2: Completion Timeout: Not Supported, TimeoutDis-, LTR-, OBFF Not Supported
		DevCtl2: Completion Timeout: 50us to 50ms, TimeoutDis-, LTR-, OBFF Disabled
		LnkCtl2: Target Link Speed: 2.5GT/s, EnterCompliance- SpeedDis-
			 Transmit Margin: Normal Operating Range, EnterModifiedCompliance- ComplianceSOS-
			 Compliance De-emphasis: -6dB
		LnkSta2: Current De-emphasis Level: -6dB, EqualizationComplete-, EqualizationPhase1-
			 EqualizationPhase2-, EqualizationPhase3-, LinkEqualizationRequest-
	Capabilities: [80] MSI-X: Enable+ Count=10 Masked-
		Vector table: BAR=4 offset=00000000
		PBA: BAR=4 offset=000f0000
	Capabilities: [98] Enhanced Allocation (EA): NumEntries=4
		Entry 0: Enable+ Writable- EntrySize=4
			 BAR Equivalent Indicator: BAR 0
			 PrimaryProperties: memory space, non-prefetchable
			 SecondaryProperties: entry unavailable for use, PrimaryProperties should be used
			 Base: 843000000000
			 MaxOffset: 03fffffff
		Entry 1: Enable+ Writable- EntrySize=4
			 BAR Equivalent Indicator: BAR 4
			 PrimaryProperties: memory space, non-prefetchable
			 SecondaryProperties: entry unavailable for use, PrimaryProperties should be used
			 Base: 843060000000
			 MaxOffset: 0000fffff
		Entry 2: Enable+ Writable- EntrySize=4
			 BAR Equivalent Indicator: VF-BAR 0
			 PrimaryProperties: VF memory space, non-prefetchable
			 SecondaryProperties: entry unavailable for use, PrimaryProperties should be used
			 Base: 8430a0000000
			 MaxOffset: 0001fffff
		Entry 3: Enable+ Writable- EntrySize=4
			 BAR Equivalent Indicator: VF-BAR 4
			 PrimaryProperties: VF memory space, non-prefetchable
			 SecondaryProperties: entry unavailable for use, PrimaryProperties should be used
			 Base: 8430e0000000
			 MaxOffset: 0001fffff
	Capabilities: [100 v1] Alternative Routing-ID Interpretation (ARI)
		ARICap:	MFVC- ACS-, Next Function: 0
		ARICtl:	MFVC- ACS-, Function Group: 0
	Capabilities: [108 v1] Vendor Specific Information: ID=00a0 Rev=1 Len=040 <?>
	Capabilities: [180 v1] Single Root I/O Virtualization (SR-IOV)
		IOVCap:	Migration-, Interrupt Message Number: 000
		IOVCtl:	Enable+ Migration- Interrupt- MSE+ ARIHierarchy+
		IOVSta:	Migration-
		Initial VFs: 128, Total VFs: 128, Number of VFs: 128, Function Dependency Link: 00
		VF offset: 1, stride: 1, Device ID: a034
		Supported Page Size: 00000553, System Page Size: 00000100
		VF Migration: offset: 00000000, BIR: 0
	Kernel driver in use: thunder-nic
00: 7d 17 1e a0 06 00 10 00 08 00 00 02 00 00 00 00
10: 00 00 00 00 00 00 00 00 00 00 00 00 00 00 00 00
20: 00 00 00 00 00 00 00 00 00 00 00 00 7d 17 1e a1
30: 00 00 00 00 40 00 00 00 00 00 00 00 00 00 00 00
40: 10 80 02 00 00 00 00 00 00 00 00 00 00 00 00 00
50: 00 00 00 00 00 00 00 00 00 00 00 00 00 00 00 00
60: 00 00 00 00 00 00 00 00 00 00 00 00 00 00 00 00
70: 00 00 00 00 00 00 00 00 00 00 00 00 00 00 00 00
80: 11 98 09 80 04 00 00 00 04 00 0f 00 00 00 00 00
90: 00 00 00 00 00 00 00 00 14 00 04 00 04 00 ff 80
a0: 02 00 00 00 fe ff ff 3f 30 84 00 00 00 00 00 00
b0: 44 00 ff 80 02 00 00 60 fe ff 0f 00 30 84 00 00
c0: 00 00 00 00 94 04 ff 80 02 00 00 a0 fe ff 1f 00
d0: 30 84 00 00 00 00 00 00 d4 04 ff 80 02 00 00 e0
e0: fe ff 1f 00 30 84 00 00 00 00 00 00 00 00 00 00
f0: 00 00 00 00 00 00 00 00 00 00 00 00 00 00 00 00
100: 0e 00 81 10 00 00 00 00 0b 00 01 18 a0 00 01 04
110: 00 00 00 00 00 00 00 00 00 00 00 00 30 84 00 00
120: 00 00 00 00 00 00 00 00 00 00 00 60 30 84 00 00
130: 00 00 00 a0 30 84 00 00 00 00 00 00 00 00 00 00
140: 00 00 00 e0 30 84 00 00 00 00 00 00 00 00 00 00
150: 00 00 00 00 00 00 00 00 00 00 00 00 00 00 00 00
160: 00 00 00 00 00 00 00 00 00 00 00 00 00 00 00 00
170: 00 00 00 00 00 00 00 00 00 00 00 00 00 00 00 00
180: 10 00 01 00 02 00 00 00 19 00 00 00 80 00 80 00
190: 80 00 00 00 01 00 01 00 00 00 34 a0 53 05 00 00
1a0: 00 01 00 00 00 00 00 00 00 00 00 00 00 00 00 00
1b0: 00 00 00 00 00 00 00 00 00 00 00 00 00 00 00 00
1c0: 00 00 00 00 00 00 00 00 00 00 00 00 00 00 00 00
1d0: 00 00 00 00 00 00 00 00 00 00 00 00 00 00 00 00
1e0: 00 00 00 00 00 00 00 00 00 00 00 00 00 00 00 00
1f0: 00 00 00 00 00 00 00 00 00 00 00 00 00 00 00 00
200: 00 00 00 00 00 00 00 00 00 00 00 00 00 00 00 00
210: 00 00 00 00 00 00 00 00 00 00 00 00 00 00 00 00
220: 00 00 00 00 00 00 00 00 00 00 00 00 00 00 00 00
230: 00 00 00 00 00 00 00 00 00 00 00 00 00 00 00 00
240: 00 00 00 00 00 00 00 00 00 00 00 00 00 00 00 00
250: 00 00 00 00 00 00 00 00 00 00 00 00 00 00 00 00
260: 00 00 00 00 00 00 00 00 00 00 00 00 00 00 00 00
270: 00 00 00 00 00 00 00 00 00 00 00 00 00 00 00 00
280: 00 00 00 00 00 00 00 00 00 00 00 00 00 00 00 00
290: 00 00 00 00 00 00 00 00 00 00 00 00 00 00 00 00
2a0: 00 00 00 00 00 00 00 00 00 00 00 00 00 00 00 00
2b0: 00 00 00 00 00 00 00 00 00 00 00 00 00 00 00 00
2c0: 00 00 00 00 00 00 00 00 00 00 00 00 00 00 00 00
2d0: 00 00 00 00 00 00 00 00 00 00 00 00 00 00 00 00
2e0: 00 00 00 00 00 00 00 00 00 00 00 00 00 00 00 00
2f0: 00 00 00 00 00 00 00 00 00 00 00 00 00 00 00 00
300: 00 00 00 00 00 00 00 00 00 00 00 00 00 00 00 00
310: 00 00 00 00 00 00 00 00 00 00 00 00 00 00 00 00
320: 00 00 00 00 00 00 00 00 00 00 00 00 00 00 00 00
330: 00 00 00 00 00 00 00 00 00 00 00 00 00 00 00 00
340: 00 00 00 00 00 00 00 00 00 00 00 00 00 00 00 00
350: 00 00 00 00 00 00 00 00 00 00 00 00 00 00 00 00
360: 00 00 00 00 00 00 00 00 00 00 00 00 00 00 00 00
370: 00 00 00 00 00 00 00 00 00 00 00 00 00 00 00 00
380: 00 00 00 00 00 00 00 00 00 00 00 00 00 00 00 00
390: 00 00 00 00 00 00 00 00 00 00 00 00 00 00 00 00
3a0: 00 00 00 00 00 00 00 00 00 00 00 00 00 00 00 00
3b0: 00 00 00 00 00 00 00 00 00 00 00 00 00 00 00 00
3c0: 00 00 00 00 00 00 00 00 00 00 00 00 00 00 00 00
3d0: 00 00 00 00 00 00 00 00 00 00 00 00 00 00 00 00
3e0: 00 00 00 00 00 00 00 00 00 00 00 00 00 00 00 00
3f0: 00 00 00 00 00 00 00 00 00 00 00 00 00 00 00 00
400: 00 00 00 00 00 00 00 00 00 00 00 00 00 00 00 00
410: 00 00 00 00 00 00 00 00 00 00 00 00 00 00 00 00
420: 00 00 00 00 00 00 00 00 00 00 00 00 00 00 00 00
430: 00 00 00 00 00 00 00 00 00 00 00 00 00 00 00 00
440: 00 00 00 00 00 00 00 00 00 00 00 00 00 00 00 00
450: 00 00 00 00 00 00 00 00 00 00 00 00 00 00 00 00
460: 00 00 00 00 00 00 00 00 00 00 00 00 00 00 00 00
470: 00 00 00 00 00 00 00 00 00 00 00 00 00 00 00 00
480: 00 00 00 00 00 00 00 00 00 00 00 00 00 00 00 00
490: 00 00 00 00 00 00 00 00 00 00 00 00 00 00 00 00
4a0: 00 00 00 00 00 00 00 00 00 00 00 00 00 00 00 00
4b0: 00 00 00 00 00 00 00 00 00 00 00 00 00 00 00 00
4c0: 00 00 00 00 00 00 00 00 00 00 00 00 00 00 00 00
4d0: 00 00 00 00 00 00 00 00 00 00 00 00 00 00 00 00
4e0: 00 00 00 00 00 00 00 00 00 00 00 00 00 00 00 00
4f0: 00 00 00 00 00 00 00 00 00 00 00 00 00 00 00 00
500: 00 00 00 00 00 00 00 00 00 00 00 00 00 00 00 00
510: 00 00 00 00 00 00 00 00 00 00 00 00 00 00 00 00
520: 00 00 00 00 00 00 00 00 00 00 00 00 00 00 00 00
530: 00 00 00 00 00 00 00 00 00 00 00 00 00 00 00 00
540: 00 00 00 00 00 00 00 00 00 00 00 00 00 00 00 00
550: 00 00 00 00 00 00 00 00 00 00 00 00 00 00 00 00
560: 00 00 00 00 00 00 00 00 00 00 00 00 00 00 00 00
570: 00 00 00 00 00 00 00 00 00 00 00 00 00 00 00 00
580: 00 00 00 00 00 00 00 00 00 00 00 00 00 00 00 00
590: 00 00 00 00 00 00 00 00 00 00 00 00 00 00 00 00
5a0: 00 00 00 00 00 00 00 00 00 00 00 00 00 00 00 00
5b0: 00 00 00 00 00 00 00 00 00 00 00 00 00 00 00 00
5c0: 00 00 00 00 00 00 00 00 00 00 00 00 00 00 00 00
5d0: 00 00 00 00 00 00 00 00 00 00 00 00 00 00 00 00
5e0: 00 00 00 00 00 00 00 00 00 00 00 00 00 00 00 00
5f0: 00 00 00 00 00 00 00 00 00 00 00 00 00 00 00 00
600: 00 00 00 00 00 00 00 00 00 00 00 00 00 00 00 00
610: 00 00 00 00 00 00 00 00 00 00 00 00 00 00 00 00
620: 00 00 00 00 00 00 00 00 00 00 00 00 00 00 00 00
630: 00 00 00 00 00 00 00 00 00 00 00 00 00 00 00 00
640: 00 00 00 00 00 00 00 00 00 00 00 00 00 00 00 00
650: 00 00 00 00 00 00 00 00 00 00 00 00 00 00 00 00
660: 00 00 00 00 00 00 00 00 00 00 00 00 00 00 00 00
670: 00 00 00 00 00 00 00 00 00 00 00 00 00 00 00 00
680: 00 00 00 00 00 00 00 00 00 00 00 00 00 00 00 00
690: 00 00 00 00 00 00 00 00 00 00 00 00 00 00 00 00
6a0: 00 00 00 00 00 00 00 00 00 00 00 00 00 00 00 00
6b0: 00 00 00 00 00 00 00 00 00 00 00 00 00 00 00 00
6c0: 00 00 00 00 00 00 00 00 00 00 00 00 00 00 00 00
6d0: 00 00 00 00 00 00 00 00 00 00 00 00 00 00 00 00
6e0: 00 00 00 00 00 00 00 00 00 00 00 00 00 00 00 00
6f0: 00 00 00 00 00 00 00 00 00 00 00 00 00 00 00 00
700: 00 00 00 00 00 00 00 00 00 00 00 00 00 00 00 00
710: 00 00 00 00 00 00 00 00 00 00 00 00 00 00 00 00
720: 00 00 00 00 00 00 00 00 00 00 00 00 00 00 00 00
730: 00 00 00 00 00 00 00 00 00 00 00 00 00 00 00 00
740: 00 00 00 00 00 00 00 00 00 00 00 00 00 00 00 00
750: 00 00 00 00 00 00 00 00 00 00 00 00 00 00 00 00
760: 00 00 00 00 00 00 00 00 00 00 00 00 00 00 00 00
770: 00 00 00 00 00 00 00 00 00 00 00 00 00 00 00 00
780: 00 00 00 00 00 00 00 00 00 00 00 00 00 00 00 00
790: 00 00 00 00 00 00 00 00 00 00 00 00 00 00 00 00
7a0: 00 00 00 00 00 00 00 00 00 00 00 00 00 00 00 00
7b0: 00 00 00 00 00 00 00 00 00 00 00 00 00 00 00 00
7c0: 00 00 00 00 00 00 00 00 00 00 00 00 00 00 00 00
7d0: 00 00 00 00 00 00 00 00 00 00 00 00 00 00 00 00
7e0: 00 00 00 00 00 00 00 00 00 00 00 00 00 00 00 00
7f0: 00 00 00 00 00 00 00 00 00 00 00 00 00 00 00 00
800: 00 00 00 00 00 00 00 00 00 00 00 00 00 00 00 00
810: 00 00 00 00 00 00 00 00 00 00 00 00 00 00 00 00
820: 00 00 00 00 00 00 00 00 00 00 00 00 00 00 00 00
830: 00 00 00 00 00 00 00 00 00 00 00 00 00 00 00 00
840: 00 00 00 00 00 00 00 00 00 00 00 00 00 00 00 00
850: 00 00 00 00 00 00 00 00 00 00 00 00 00 00 00 00
860: 00 00 00 00 00 00 00 00 00 00 00 00 00 00 00 00
870: 00 00 00 00 00 00 00 00 00 00 00 00 00 00 00 00
880: 00 00 00 00 00 00 00 00 00 00 00 00 00 00 00 00
890: 00 00 00 00 00 00 00 00 00 00 00 00 00 00 00 00
8a0: 00 00 00 00 00 00 00 00 00 00 00 00 00 00 00 00
8b0: 00 00 00 00 00 00 00 00 00 00 00 00 00 00 00 00
8c0: 00 00 00 00 00 00 00 00 00 00 00 00 00 00 00 00
8d0: 00 00 00 00 00 00 00 00 00 00 00 00 00 00 00 00
8e0: 00 00 00 00 00 00 00 00 00 00 00 00 00 00 00 00
8f0: 00 00 00 00 00 00 00 00 00 00 00 00 00 00 00 00
900: 00 00 00 00 00 00 00 00 00 00 00 00 00 00 00 00
910: 00 00 00 00 00 00 00 00 00 00 00 00 00 00 00 00
920: 00 00 00 00 00 00 00 00 00 00 00 00 00 00 00 00
930: 00 00 00 00 00 00 00 00 00 00 00 00 00 00 00 00
940: 00 00 00 00 00 00 00 00 00 00 00 00 00 00 00 00
950: 00 00 00 00 00 00 00 00 00 00 00 00 00 00 00 00
960: 00 00 00 00 00 00 00 00 00 00 00 00 00 00 00 00
970: 00 00 00 00 00 00 00 00 00 00 00 00 00 00 00 00
980: 00 00 00 00 00 00 00 00 00 00 00 00 00 00 00 00
990: 00 00 00 00 00 00 00 00 00 00 00 00 00 00 00 00
9a0: 00 00 00 00 00 00 00 00 00 00 00 00 00 00 00 00
9b0: 00 00 00 00 00 00 00 00 00 00 00 00 00 00 00 00
9c0: 00 00 00 00 00 00 00 00 00 00 00 00 00 00 00 00
9d0: 00 00 00 00 00 00 00 00 00 00 00 00 00 00 00 00
9e0: 00 00 00 00 00 00 00 00 00 00 00 00 00 00 00 00
9f0: 00 00 00 00 00 00 00 00 00 00 00 00 00 00 00 00
a00: 00 00 00 00 00 00 00 00 00 00 00 00 00 00 00 00
a10: 00 00 00 00 00 00 00 00 00 00 00 00 00 00 00 00
a20: 00 00 00 00 00 00 00 00 00 00 00 00 00 00 00 00
a30: 00 00 00 00 00 00 00 00 00 00 00 00 00 00 00 00
a40: 00 00 00 00 00 00 00 00 00 00 00 00 00 00 00 00
a50: 00 00 00 00 00 00 00 00 00 00 00 00 00 00 00 00
a60: 00 00 00 00 00 00 00 00 00 00 00 00 00 00 00 00
a70: 00 00 00 00 00 00 00 00 00 00 00 00 00 00 00 00
a80: 00 00 00 00 00 00 00 00 00 00 00 00 00 00 00 00
a90: 00 00 00 00 00 00 00 00 00 00 00 00 00 00 00 00
aa0: 00 00 00 00 00 00 00 00 00 00 00 00 00 00 00 00
ab0: 00 00 00 00 00 00 00 00 00 00 00 00 00 00 00 00
ac0: 00 00 00 00 00 00 00 00 00 00 00 00 00 00 00 00
ad0: 00 00 00 00 00 00 00 00 00 00 00 00 00 00 00 00
ae0: 00 00 00 00 00 00 00 00 00 00 00 00 00 00 00 00
af0: 00 00 00 00 00 00 00 00 00 00 00 00 00 00 00 00
b00: 00 00 00 00 00 00 00 00 00 00 00 00 00 00 00 00
b10: 00 00 00 00 00 00 00 00 00 00 00 00 00 00 00 00
b20: 00 00 00 00 00 00 00 00 00 00 00 00 00 00 00 00
b30: 00 00 00 00 00 00 00 00 00 00 00 00 00 00 00 00
b40: 00 00 00 00 00 00 00 00 00 00 00 00 00 00 00 00
b50: 00 00 00 00 00 00 00 00 00 00 00 00 00 00 00 00
b60: 00 00 00 00 00 00 00 00 00 00 00 00 00 00 00 00
b70: 00 00 00 00 00 00 00 00 00 00 00 00 00 00 00 00
b80: 00 00 00 00 00 00 00 00 00 00 00 00 00 00 00 00
b90: 00 00 00 00 00 00 00 00 00 00 00 00 00 00 00 00
ba0: 00 00 00 00 00 00 00 00 00 00 00 00 00 00 00 00
bb0: 00 00 00 00 00 00 00 00 00 00 00 00 00 00 00 00
bc0: 00 00 00 00 00 00 00 00 00 00 00 00 00 00 00 00
bd0: 00 00 00 00 00 00 00 00 00 00 00 00 00 00 00 00
be0: 00 00 00 00 00 00 00 00 00 00 00 00 00 00 00 00
bf0: 00 00 00 00 00 00 00 00 00 00 00 00 00 00 00 00
c00: 00 00 00 00 00 00 00 00 00 00 00 00 00 00 00 00
c10: 00 00 00 00 00 00 00 00 00 00 00 00 00 00 00 00
c20: 00 00 00 00 00 00 00 00 00 00 00 00 00 00 00 00
c30: 00 00 00 00 00 00 00 00 00 00 00 00 00 00 00 00
c40: 00 00 00 00 00 00 00 00 00 00 00 00 00 00 00 00
c50: 00 00 00 00 00 00 00 00 00 00 00 00 00 00 00 00
c60: 00 00 00 00 00 00 00 00 00 00 00 00 00 00 00 00
c70: 00 00 00 00 00 00 00 00 00 00 00 00 00 00 00 00
c80: 00 00 00 00 00 00 00 00 00 00 00 00 00 00 00 00
c90: 00 00 00 00 00 00 00 00 00 00 00 00 00 00 00 00
ca0: 00 00 00 00 00 00 00 00 00 00 00 00 00 00 00 00
cb0: 00 00 00 00 00 00 00 00 00 00 00 00 00 00 00 00
cc0: 00 00 00 00 00 00 00 00 00 00 00 00 00 00 00 00
cd0: 00 00 00 00 00 00 00 00 00 00 00 00 00 00 00 00
ce0: 00 00 00 00 00 00 00 00 00 00 00 00 00 00 00 00
cf0: 00 00 00 00 00 00 00 00 00 00 00 00 00 00 00 00
d00: 00 00 00 00 00 00 00 00 00 00 00 00 00 00 00 00
d10: 00 00 00 00 00 00 00 00 00 00 00 00 00 00 00 00
d20: 00 00 00 00 00 00 00 00 00 00 00 00 00 00 00 00
d30: 00 00 00 00 00 00 00 00 00 00 00 00 00 00 00 00
d40: 00 00 00 00 00 00 00 00 00 00 00 00 00 00 00 00
d50: 00 00 00 00 00 00 00 00 00 00 00 00 00 00 00 00
d60: 00 00 00 00 00 00 00 00 00 00 00 00 00 00 00 00
d70: 00 00 00 00 00 00 00 00 00 00 00 00 00 00 00 00
d80: 00 00 00 00 00 00 00 00 00 00 00 00 00 00 00 00
d90: 00 00 00 00 00 00 00 00 00 00 00 00 00 00 00 00
da0: 00 00 00 00 00 00 00 00 00 00 00 00 00 00 00 00
db0: 00 00 00 00 00 00 00 00 00 00 00 00 00 00 00 00
dc0: 00 00 00 00 00 00 00 00 00 00 00 00 00 00 00 00
dd0: 00 00 00 00 00 00 00 00 00 00 00 00 00 00 00 00
de0: 00 00 00 00 00 00 00 00 00 00 00 00 00 00 00 00
df0: 00 00 00 00 00 00 00 00 00 00 00 00 00 00 00 00
e00: 00 00 00 00 00 00 00 00 00 00 00 00 00 00 00 00
e10: 00 00 00 00 00 00 00 00 00 00 00 00 00 00 00 00
e20: 00 00 00 00 00 00 00 00 00 00 00 00 00 00 00 00
e30: 00 00 00 00 00 00 00 00 00 00 00 00 00 00 00 00
e40: 00 00 00 00 00 00 00 00 00 00 00 00 00 00 00 00
e50: 00 00 00 00 00 00 00 00 00 00 00 00 00 00 00 00
e60: 00 00 00 00 00 00 00 00 00 00 00 00 00 00 00 00
e70: 00 00 00 00 00 00 00 00 00 00 00 00 00 00 00 00
e80: 00 00 00 00 00 00 00 00 00 00 00 00 00 00 00 00
e90: 00 00 00 00 00 00 00 00 00 00 00 00 00 00 00 00
ea0: 00 00 00 00 00 00 00 00 00 00 00 00 00 00 00 00
eb0: 00 00 00 00 00 00 00 00 00 00 00 00 00 00 00 00
ec0: 00 00 00 00 00 00 00 00 00 00 00 00 00 00 00 00
ed0: 00 00 00 00 00 00 00 00 00 00 00 00 00 00 00 00
ee0: 00 00 00 00 00 00 00 00 00 00 00 00 00 00 00 00
ef0: 00 00 00 00 00 00 00 00 00 00 00 00 00 00 00 00
f00: 00 00 00 00 00 00 00 00 00 00 00 00 00 00 00 00
f10: 00 00 00 00 00 00 00 00 00 00 00 00 00 00 00 00
f20: 00 00 00 00 00 00 00 00 00 00 00 00 00 00 00 00
f30: 00 00 00 00 00 00 00 00 00 00 00 00 00 00 00 00
f40: 00 00 00 00 00 00 00 00 00 00 00 00 00 00 00 00
f50: 00 00 00 00 00 00 00 00 00 00 00 00 00 00 00 00
f60: 00 00 00 00 00 00 00 00 00 00 00 00 00 00 00 00
f70: 00 00 00 00 00 00 00 00 00 00 00 00 00 00 00 00
f80: 00 00 00 00 00 00 00 00 00 00 00 00 00 00 00 00
f90: 00 00 00 00 00 00 00 00 00 00 00 00 00 00 00 00
fa0: 00 00 00 00 00 00 00 00 00 00 00 00 00 00 00 00
fb0: 00 00 00 00 00 00 00 00 00 00 00 00 00 00 00 00
fc0: 00 00 00 00 00 00 00 00 00 00 00 00 00 00 00 00
fd0: 00 00 00 00 00 00 00 00 00 00 00 00 00 00 00 00
fe0: 00 00 00 00 00 00 00 00 00 00 00 00 00 00 00 00
ff0: 00 00 00 00 00 00 00 00 00 00 00 00 00 00 00 00

